{
  "title": "Ride-hailing platform",
  "direction": "right",
  "groups": [
    {
      "id": "edge",
      "label": "Riders and drivers",
      "kind": "tier"
    },
    {
      "id": "us-east",
      "label": "us-east-1",
      "kind": "region"
    },
    {
      "id": "core",
      "label": "Core services",
      "kind": "tier",
      "parent": "us-east"
    },
    {
      "id": "data",
      "label": "Data tier",
      "kind": "tier",
      "parent": "us-east"
    },
    {
      "id": "partners",
      "label": "Third parties",
      "kind": "boundary"
    }
  ],
  "components": [
    {
      "id": "rider-app",
      "label": "Rider app",
      "kind": "client",
      "group": "edge",
      "tech": "iOS / Android"
    },
    {
      "id": "driver-app",
      "label": "Driver app",
      "kind": "client",
      "group": "edge",
      "tech": "Android"
    },
    {
      "id": "api-gateway",
      "label": "API gateway",
      "kind": "gateway",
      "group": "core",
      "replicas": 3
    },
    {
      "id": "trip-service",
      "label": "Trip service",
      "kind": "service",
      "group": "core",
      "replicas": 4,
      "tech": "Go"
    },
    {
      "id": "matching",
      "label": "Matching service",
      "kind": "service",
      "group": "core",
      "replicas": 2,
      "tech": "Go"
    },
    {
      "id": "pricing",
      "label": "Pricing service",
      "kind": "service",
      "group": "core",
      "tech": "Python"
    },
    {
      "id": "surge",
      "label": "Surge calculator",
      "kind": "function",
      "group": "core",
      "tech": "Lambda"
    },
    {
      "id": "trip-db",
      "label": "Trip DB (primary)",
      "kind": "database",
      "group": "data",
      "tech": "PostgreSQL 16"
    },
    {
      "id": "trip-db-replica",
      "label": "Trip DB (replica)",
      "kind": "database",
      "group": "data",
      "tech": "PostgreSQL 16"
    },
    {
      "id": "location-cache",
      "label": "Driver locations",
      "kind": "cache",
      "group": "data",
      "tech": "Redis 7"
    },
    {
      "id": "trip-events",
      "label": "Trip events",
      "kind": "queue",
      "group": "data",
      "tech": "Kafka"
    },
    {
      "id": "history",
      "label": "Ride history",
      "kind": "storage",
      "group": "data",
      "tech": "S3"
    },
    {
      "id": "maps",
      "label": "Maps provider",
      "kind": "external",
      "group": "partners"
    },
    {
      "id": "payments",
      "label": "Payments processor",
      "kind": "external",
      "group": "partners"
    }
  ],
  "connections": [
    {
      "from": "rider-app",
      "to": "api-gateway",
      "kind": "sync",
      "label": "HTTPS",
      "load": 0.8
    },
    {
      "from": "driver-app",
      "to": "api-gateway",
      "kind": "sync",
      "label": "HTTPS",
      "load": 0.6
    },
    {
      "from": "driver-app",
      "to": "location-cache",
      "kind": "dataflow",
      "label": "GPS pings",
      "load": 0.9
    },
    {
      "from": "api-gateway",
      "to": "trip-service",
      "kind": "sync",
      "label": "gRPC",
      "load": 0.8
    },
    {
      "from": "api-gateway",
      "to": "pricing",
      "kind": "sync",
      "label": "gRPC",
      "load": 0.4
    },
    {
      "from": "trip-service",
      "to": "matching",
      "kind": "sync",
      "label": "gRPC",
      "load": 0.5
    },
    {
      "from": "trip-service",
      "to": "trip-db",
      "kind": "sync",
      "label": "SQL writes",
      "load": 0.7
    },
    {
      "from": "trip-service",
      "to": "trip-db-replica",
      "kind": "sync",
      "label": "SQL reads",
      "load": 0.3
    },
    {
      "from": "trip-db",
      "to": "trip-db-replica",
      "kind": "replication",
      "label": "streaming",
      "load": 0.5
    },
    {
      "from": "trip-service",
      "to": "trip-events",
      "kind": "async",
      "label": "publish",
      "load": 0.6
    },
    {
      "from": "trip-events",
      "to": "history",
      "kind": "dataflow",
      "label": "archive",
      "load": 0.4
    },
    {
      "from": "matching",
      "to": "location-cache",
      "kind": "sync",
      "label": "GEO queries",
      "load": 0.7
    },
    {
      "from": "pricing",
      "to": "surge",
      "kind": "sync",
      "label": "invoke",
      "load": 0.3
    },
    {
      "from": "surge",
      "to": "location-cache",
      "kind": "sync",
      "label": "density",
      "load": 0.2
    },
    {
      "from": "trip-service",
      "to": "partners",
      "kind": "sync",
      "label": "charge / route",
      "load": 0.4
    },
    {
      "from": "matching",
      "to": "maps",
      "kind": "sync",
      "label": "ETA",
      "load": 0.5
    }
  ]
}