{
  "$schema": "https://raw.githubusercontent.com/adamgilman/Orrery/main/packages/core/schema/v1.json",
  "title": "Checkout: connected",
  "direction": "down",
  "groups": [
    {
      "id": "data",
      "label": "Data",
      "kind": "tier"
    },
    {
      "id": "sessions",
      "label": "Session cache",
      "kind": "cluster",
      "parent": "data"
    },
    {
      "id": "cache-a",
      "label": "Node A",
      "kind": "cluster",
      "parent": "sessions"
    },
    {
      "id": "cache-b",
      "label": "Node B",
      "kind": "cluster",
      "parent": "sessions"
    }
  ],
  "components": [
    {
      "id": "web",
      "label": "Storefront",
      "kind": "client"
    },
    {
      "id": "api",
      "label": "Checkout API",
      "kind": "service"
    },
    {
      "id": "db",
      "label": "Orders DB",
      "kind": "database",
      "group": "data"
    },
    {
      "id": "replica",
      "label": "Read replica",
      "kind": "database",
      "group": "data"
    },
    {
      "id": "redis-a",
      "label": "Redis",
      "kind": "cache",
      "group": "cache-a"
    },
    {
      "id": "aof-a",
      "label": "Append-only file",
      "kind": "storage",
      "group": "cache-a"
    },
    {
      "id": "redis-b",
      "label": "Redis",
      "kind": "cache",
      "group": "cache-b"
    },
    {
      "id": "aof-b",
      "label": "Append-only file",
      "kind": "storage",
      "group": "cache-b"
    }
  ],
  "connections": [
    {
      "from": "web",
      "to": "api",
      "load": 0.8
    },
    {
      "from": "api",
      "to": "db",
      "load": 0.6,
      "label": "writes"
    },
    {
      "id": "failover",
      "from": "api",
      "to": "replica",
      "load": 0
    },
    {
      "from": "db",
      "to": "replica",
      "kind": "replication",
      "load": 0.2
    },
    {
      "from": "api",
      "to": "sessions",
      "load": 0.5
    },
    {
      "from": "redis-a",
      "to": "aof-a",
      "kind": "dataflow",
      "load": 0.3
    },
    {
      "from": "redis-b",
      "to": "aof-b",
      "kind": "dataflow",
      "load": 0.3
    },
    {
      "from": "cache-a",
      "to": "cache-b",
      "kind": "replication",
      "load": 0.2
    }
  ]
}
